estimator_id,parameter,statistic,estimator,metric_column,estimate,standard_error,standard_error_method,n,sum_weights,effective_n,distribution_card_metric_id,upstream_warning_ids,limitations
activation_rate_naive,Population share of eligible users activated within seven days.,Unweighted sample proportion of activated_7d among observed respondents.,sample_proportion,activated_7d,0.8,0.178885,binomial_plugin,5,,5.0,activation_7d,frame_segment_coverage|sample_segment_response|unequal_inclusion_probabilities_declared,"Ignores unequal inclusion probabilities.|Inherits coverage and non-response warnings from the sampling audit.|Sampling audit warnings: frame_segment_coverage, sample_segment_response, unequal_inclusion_probabilities_declared"
activation_rate_weighted,Population share of eligible users activated within seven days.,Inverse-probability weighted sample proportion of activated_7d among observed respondents.,inverse_probability_weighted_proportion,activated_7d,0.84375,0.164232,weighted_plugin,5,10.666667,4.887828,activation_7d,frame_segment_coverage|sample_segment_response|unequal_inclusion_probabilities_declared,"Uses inclusion weights but does not correct non-response.|Effective sample size is approximate and small.|Sampling audit warnings: frame_segment_coverage, sample_segment_response, unequal_inclusion_probabilities_declared"
first_order_amount_rub_weighted_mean,Population mean first order amount in RUB across eligible users in the seven-day window.,"Inverse-probability weighted mean of first_order_amount_rub among observed respondents, including zero amounts.",inverse_probability_weighted_mean,first_order_amount_rub,767.34374,236.147391,weighted_plugin,5,10.666667,4.887828,first_order_amount_rub_positive,frame_segment_coverage|sample_segment_response|unequal_inclusion_probabilities_declared,"Includes zero revenue as real business mass.|Revenue distribution card flags zero mass and small positive sample.|Sampling audit warnings: frame_segment_coverage, sample_segment_response, unequal_inclusion_probabilities_declared"
onboarding_seconds_median,Population median onboarding duration among observed eligible users.,Unweighted sample median of onboarding_seconds among observed respondents.,sample_quantile,onboarding_seconds,520.0,,not_computed_until_bootstrap,5,,5.0,onboarding_seconds,frame_segment_coverage|sample_segment_response|unequal_inclusion_probabilities_declared,"Quantile standard error is deferred to bootstrap.|Distribution card flags a visible right tail.|Sampling audit warnings: frame_segment_coverage, sample_segment_response, unequal_inclusion_probabilities_declared"
support_tickets_per_user_weighted_rate,Population support tickets per eligible user in the seven-day window.,Inverse-probability weighted count rate per observed user window.,inverse_probability_weighted_rate,support_tickets_7d,0.46875,0.225716,weighted_plugin,5,10.666667,4.887828,support_tickets_7d,frame_segment_coverage|sample_segment_response|unequal_inclusion_probabilities_declared,"Uses a count model diagnostic, not an incident root-cause model.|Small sample makes dispersion diagnostics weak.|Sampling audit warnings: frame_segment_coverage, sample_segment_response, unequal_inclusion_probabilities_declared"
